{
  "$schema": "https://json-schema.org/draft/2020-12/schema",
  "type": "object",
  "additionalProperties": false,
  "required": ["ok", "data", "error", "meta"],
  "properties": {
    "ok": { "const": true },
    "data": {
      "type": "object",
      "additionalProperties": false,
      "required": ["attempt", "brief"],
      "properties": {
        "attempt": {
          "type": "object",
          "additionalProperties": false,
          "required": [
            "attempt_id", "edition_id", "mode", "state", "sequence",
            "assisted", "issued_at", "grace_end_at"
          ],
          "properties": {
            "attempt_id": { "type": "string", "pattern": "^[A-Za-z0-9_-]{43}$" },
            "edition_id": { "$ref": "#/$defs/identifier" },
            "mode": { "const": "official" },
            "state": { "const": "issued" },
            "sequence": { "const": 0 },
            "assisted": { "const": false },
            "issued_at": { "$ref": "#/$defs/timestamp" },
            "grace_end_at": { "$ref": "#/$defs/timestamp" }
          }
        },
        "brief": { "$ref": "#/$defs/brief" }
      }
    },
    "error": { "type": "null" },
    "meta": {
      "type": "object",
      "additionalProperties": false,
      "required": ["request_id", "api_version"],
      "properties": {
        "request_id": {
          "type": "string",
          "pattern": "^[0-9a-f]{8}-[0-9a-f]{4}-[1-5][0-9a-f]{3}-[89ab][0-9a-f]{3}-[0-9a-f]{12}$"
        },
        "api_version": { "const": "v1" }
      }
    }
  },
  "$defs": {
    "identifier": {
      "type": "string",
      "pattern": "^[a-z0-9_]+$",
      "minLength": 1,
      "maxLength": 80
    },
    "timestamp": {
      "type": "string",
      "pattern": "^\\d{4}-\\d{2}-\\d{2}T\\d{2}:\\d{2}:\\d{2}\\.\\d{3}Z$"
    },
    "option": {
      "type": "object",
      "additionalProperties": false,
      "required": ["id", "label"],
      "properties": {
        "id": { "$ref": "#/$defs/identifier" },
        "label": { "type": "string", "minLength": 1, "maxLength": 160 }
      }
    },
    "brief": {
      "type": "object",
      "additionalProperties": false,
      "required": [
        "schemaVersion", "editionId", "caseRevision", "title", "focus",
        "origin", "facts", "actions", "qualifiers", "evidence"
      ],
      "properties": {
        "schemaVersion": { "const": 1 },
        "editionId": { "$ref": "#/$defs/identifier" },
        "caseRevision": { "$ref": "#/$defs/identifier" },
        "title": { "type": "string", "minLength": 1, "maxLength": 160 },
        "focus": { "type": "string", "minLength": 1, "maxLength": 240 },
        "origin": { "enum": ["synthetic", "professional"] },
        "facts": {
          "type": "array", "minItems": 1, "maxItems": 30,
          "items": {
            "type": "object", "additionalProperties": false,
            "required": ["id", "status", "text"],
            "properties": {
              "id": { "$ref": "#/$defs/identifier" },
              "status": { "enum": ["confirmed", "last_seen", "inferred", "unknown"] },
              "text": { "type": "string", "minLength": 1, "maxLength": 500 }
            }
          }
        },
        "actions": {
          "type": "array", "minItems": 3, "maxItems": 5,
          "items": {
            "type": "object", "additionalProperties": false,
            "required": ["id", "label", "qualifierIds"],
            "properties": {
              "id": { "$ref": "#/$defs/identifier" },
              "label": { "type": "string", "minLength": 1, "maxLength": 120 },
              "qualifierIds": {
                "type": "array", "minItems": 2, "maxItems": 4,
                "uniqueItems": true,
                "items": { "$ref": "#/$defs/identifier" }
              }
            }
          }
        },
        "qualifiers": {
          "type": "array", "minItems": 2, "maxItems": 20,
          "items": { "$ref": "#/$defs/option" }
        },
        "evidence": {
          "type": "array", "minItems": 5, "maxItems": 5,
          "items": { "$ref": "#/$defs/option" }
        }
      }
    }
  }
}
